name        , type       , strDefault, attributes                     , upgrades, docOrder, description
range       , blkrange   ,           , sorts|width=150px|readOnly     ,         ,        1, the block range (inclusive) covered by this chunk
magic       , string     ,           , sorts|width=150px|readOnly     ,         ,        2, an internal use only magic number to indicate file format
hash        , hash       ,           , sorts|width=150px|readOnly     ,         ,        3, the hash of the specification under which this chunk was generated
nAddresses  , uint64     ,           , sorts|width=150px|readOnly     ,         ,        4, the number of addresses in this chunk
nAppearances, uint64     ,           , sorts|width=150px|readOnly     ,         ,        5, the number of appearances in this chunk
size        , uint64     ,           , sorts|width=150px|readOnly     ,         ,        6, the size of the chunk in bytes
rangeDates  , *RangeDates,           , noui|sorts|width=150px|readOnly,         ,        7, if verbose&#44; the block and timestamp bounds of the chunk (may be null)
